{
  "schema_version": "1.0",
  "run_id": "orchestrate-2026-05-12T09:45:44Z",
  "created_at": "2026-05-12T09:45:44Z",
  "updated_at": "2026-05-12T09:46:17Z",
  "config_snapshot": {},
  "features": [],
  "counters": {
    "queued": 0,
    "running": 0,
    "blocked": 0,
    "failed": 0,
    "complete": 0
  },
  "events_log_path": "events.log"
}
